<?xml version="1.0" encoding="UTF-8"?>
<InvoiceSystem xmlns:xsi="http://www.w3.org/2001/XMLSchema-instance"
               xsi:noNamespaceSchemaLocation="invoice.xsd">

  <Customers>
    <Customer CustomerID="C01">
      <Name>Nguyen Van A</Name>
      <Phone>0123456789</Phone>
    </Customer>

    <Customer CustomerID="C02">
      <Name>Tran Thi B</Name>
      <Phone>0987654321</Phone>
    </Customer>
  </Customers>

  <Products>
    <Product ProductID="P01">
      <Name>Laptop</Name>
      <Price>1500</Price>
      <Stock>10</Stock>
    </Product>

    <Product ProductID="P02">
      <Name>Mouse</Name>
      <Price>20</Price>
      <Stock>50</Stock>
    </Product>
  </Products>

  <Invoices>
    <Invoice InvoiceID="I01" CustomerID="C01">
      <Date>2024-05-01</Date>
      <TotalAmount>1520</TotalAmount>
    </Invoice>

    <Invoice InvoiceID="I02" CustomerID="C02">
      <Date>2024-05-02</Date>
      <TotalAmount>40</TotalAmount>
    </Invoice>
  </Invoices>

  <InvoiceDetails>
    <InvoiceDetail InvoiceDetailID="D01" InvoiceID="I01" ProductID="P01">
      <Quantity>1</Quantity>
      <UnitPrice>1500</UnitPrice>
    </InvoiceDetail>

    <InvoiceDetail InvoiceDetailID="D02" InvoiceID="I01" ProductID="P02">
      <Quantity>1</Quantity>
      <UnitPrice>20</UnitPrice>
    </InvoiceDetail>

    <InvoiceDetail InvoiceDetailID="D03" InvoiceID="I02" ProductID="P02">
      <Quantity>2</Quantity>
      <UnitPrice>20</UnitPrice>
    </InvoiceDetail>
  </InvoiceDetails>

</InvoiceSystem>